{
  "$schema": "http://json-schema.org/draft-07/schema#",
  "title": "CharacterClassData Schema",
  "type": "object",
  "properties": {
    "name": {
      "type": "string"
    },
    "description": {
      "type": "string"
    },
    "restrictions": {
      "type": "array",
      "items": {
        "type": "object"
      }
    },
    "levelData": {
      "type": "array",
      "items": {
        "type": "object"
      }
    },
    "id": {
      "type": "string"
    }
  }
}
